54,Predictive Policing Biases of PredPol,2015-11-18,predpol,"predpol, oakland-police-department",oakland-residents,financial means; race,law enforcement,yes,no,no,yes,no,no,no,no,yes,"no tangible harm, near-miss, or issue",yes,yes,False,none,no,maybe,no,no,yes,yes,True,yes,yes,Autonomy3,No. Not intentionally designed to perform harm,Machine Learning,002,False,6. Complete and final,54,002,"The potential of tangible harm, such as through a wrongful detainment or violent altercations with the police, has been considered but not considered applicable here because there is no explicit mention of tangible harm risk in the associated incident reports. ",,yes,"The use of historical crime data as input into the algorithm's prediction leads to a feedback loop. The algorithm predicts more crimes in neighborhoods with high recorded crime levels in the past which, due to historical overpolicing, tend to disproportionately affect low-income and minority communities. This leads to higher police presence in these neighborhoods, which by default increases the number of recorded crimes there. This could potentially lead to situations in which citizens of these communities are perceived as 'guilty by association' and loose their right to individualized treatment, rather than as a statistic.  Even though neither race nor income are variables used in the algorithm explicitly, the algorithm's predictions are 'biased-by-proxy'. 
This effect has been demonstrated in a study by Gizmodo, who find that the predpol predictions have led to a vast increase in police patrols in minority neighborhoods. ",2011,,,True,no,no,,,US,North America,,,"Earliest deployment of this software was by LAPD in 2011. LAPD had access to a prototype of the software. This incident describes a variant of many different events involving predictive policing software. 

In Oakland, CA, in 2015, the Police Department convinced the mayor to earmark funds for predictive policing software but later rescinded the funding request.

In Jennings, MO, in 2015, the St. Louis County Police Department tried out software created by HunchLab.

In Richmond, VA, in 2016, the Police Department terminated its contract with PredPol halfway into a three year program because it found no measurable impact on crime reduction.

In 2021, Gizmodo published a report about PredPol where it found predictive policing software disproportionately targets low-income, Black, and Latino neighborhoods.

PredPol was also briefly mentioned as being deployed in other locations like Santa Cruz, CA, Atlanta, GA, Chicago, IL, and Los Angeles, CA.","{'attributes': [{'short_name': 'Entity', 'value_json': '""Los Angeles Police Department""'}, {'short_name': 'Named Entity', 'value_json': 'true'}, {'short_name': 'Entity type', 'value_json': '""government entity""'}, {'short_name': 'Entity Relationship to the AI', 'value_json': '[""deployer""]'}, {'short_name': 'Harm Category Experienced', 'value_json': '""not applicable""'}, {'short_name': 'Harm Type Experienced', 'value_json': '""not applicable""'}]}; {'attributes': [{'short_name': 'Entity', 'value_json': '""PredPol software""'}, {'short_name': 'Named Entity', 'value_json': 'true'}, {'short_name': 'Entity type', 'value_json': '""product""'}, {'short_name': 'Entity Relationship to the AI', 'value_json': '[""AI""]'}, {'short_name': 'Harm Category Experienced', 'value_json': '""not applicable""'}, {'short_name': 'Harm Type Experienced', 'value_json': '""not applicable""'}, {'short_name': 'Notes (Characterizing Entities and the Harm)', 'value_json': '""Contains ML""'}]}; {'attributes': [{'short_name': 'Entity', 'value_json': '""Residents of minority and low-income neighborhoods""'}, {'short_name': 'Named Entity', 'value_json': 'false'}, {'short_name': 'Entity type', 'value_json': '""group of individuals""'}, {'short_name': 'Entity Relationship to the AI', 'value_json': '[""affected non-user""]'}, {'short_name': 'Harm Category Experienced', 'value_json': '""AI special interest intangible harm""'}, {'short_name': 'Harm Type Experienced', 'value_json': '""disproportionate treatment based upon a protected characteristic""'}, {'short_name': 'Notes (Characterizing Entities and the Harm)', 'value_json': '""The Predpol software led to over policing in low-income and minority communities.""'}]}; {'attributes': [{'short_name': 'Entity', 'value_json': '""HunchLab""'}, {'short_name': 'Named Entity', 'value_json': 'true'}, {'short_name': 'Entity type', 'value_json': '""product""'}, {'short_name': 'Entity Relationship to the AI', 'value_json': '[""AI""]'}, {'short_name': 'Harm Category Experienced', 'value_json': '""not applicable""'}, {'short_name': 'Harm Type Experienced', 'value_json': '""not applicable""'}]}; {'attributes': [{'short_name': 'Entity', 'value_json': '""Lincoln (NE) Police Department""'}, {'short_name': 'Named Entity', 'value_json': 'true'}, {'short_name': 'Entity type', 'value_json': '""government entity""'}, {'short_name': 'Entity Relationship to the AI', 'value_json': '[""deployer"",""user""]'}, {'short_name': 'Harm Category Experienced', 'value_json': '""not applicable""'}, {'short_name': 'Harm Type Experienced', 'value_json': '""not applicable""'}]}; {'attributes': [{'short_name': 'Entity', 'value_json': '""Burbank Police Department""'}, {'short_name': 'Named Entity', 'value_json': 'true'}, {'short_name': 'Entity type', 'value_json': '""government entity""'}, {'short_name': 'Entity Relationship to the AI', 'value_json': '[""deployer"",""user""]'}, {'short_name': 'Harm Category Experienced', 'value_json': '""not applicable""'}, {'short_name': 'Harm Type Experienced', 'value_json': '""not applicable""'}]}; {'attributes': [{'short_name': 'Entity', 'value_json': '""Azavea""'}, {'short_name': 'Named Entity', 'value_json': 'true'}, {'short_name': 'Entity type', 'value_json': '""for-profit organization""'}, {'short_name': 'Entity Relationship to the AI', 'value_json': '[""developer""]'}, {'short_name': 'Harm Category Experienced', 'value_json': '""not applicable""'}, {'short_name': 'Harm Type Experienced', 'value_json': '""not applicable""'}, {'short_name': 'Notes (Characterizing Entities and the Harm)', 'value_json': '""HunchLab developer""'}]}; {'attributes': [{'short_name': 'Entity', 'value_json': '""Human Rights Data Analysis Group""'}, {'short_name': 'Named Entity', 'value_json': 'true'}, {'short_name': 'Entity type', 'value_json': '""non-profit organization""'}, {'short_name': 'Entity Relationship to the AI', 'value_json': '[""researcher"",""watchdog""]'}, {'short_name': 'Harm Category Experienced', 'value_json': '""not applicable""'}, {'short_name': 'Harm Type Experienced', 'value_json': '""not applicable""'}]}; {'attributes': [{'short_name': 'Entity', 'value_json': '""Geolitica (formerly PredPol)""'}, {'short_name': 'Named Entity', 'value_json': 'true'}, {'short_name': 'Entity type', 'value_json': '""for-profit organization""'}, {'short_name': 'Entity Relationship to the AI', 'value_json': '[""developer""]'}, {'short_name': 'Harm Category Experienced', 'value_json': '""not applicable""'}, {'short_name': 'Harm Type Experienced', 'value_json': '""not applicable""'}]}; {'attributes': [{'short_name': 'Entity', 'value_json': '""UCLA Institute for Pure and Applied Mathematics""'}, {'short_name': 'Named Entity', 'value_json': 'true'}, {'short_name': 'Entity type', 'value_json': '""other""'}, {'short_name': 'Notes (Characterizing Entities and the Harm)', 'value_json': '""7.3 - research institution""'}, {'short_name': 'Entity Relationship to the AI', 'value_json': '[""developer""]'}, {'short_name': 'Harm Category Experienced', 'value_json': '""not applicable""'}, {'short_name': 'Harm Type Experienced', 'value_json': '""not applicable""'}]}; {'attributes': [{'short_name': 'Entity', 'value_json': '""LAPD Captain Sean Malinowski""'}, {'short_name': 'Named Entity', 'value_json': 'true'}, {'short_name': 'Entity type', 'value_json': '""individual""'}, {'short_name': 'Entity Relationship to the AI', 'value_json': '[""developer""]'}, {'short_name': 'Harm Category Experienced', 'value_json': '""not applicable""'}, {'short_name': 'Harm Type Experienced', 'value_json': '""not applicable""'}]}; {'attributes': [{'short_name': 'Entity', 'value_json': '""PredPol""'}, {'short_name': 'Named Entity', 'value_json': 'true'}, {'short_name': 'Entity type', 'value_json': '""product""'}, {'short_name': 'Entity Relationship to the AI', 'value_json': '[""product containing AI""]'}, {'short_name': 'Harm Category Experienced', 'value_json': '""not applicable""'}, {'short_name': 'Harm Type Experienced', 'value_json': '""not applicable""'}]}; {'attributes': [{'short_name': 'Entity', 'value_json': '""St. Louis County Police Department""'}, {'short_name': 'Named Entity', 'value_json': 'true'}, {'short_name': 'Entity type', 'value_json': '""government entity""'}, {'short_name': 'Entity Relationship to the AI', 'value_json': '[""deployer"",""user""]'}, {'short_name': 'Harm Category Experienced', 'value_json': '""not applicable""'}, {'short_name': 'Harm Type Experienced', 'value_json': '""not applicable""'}, {'short_name': 'Notes (Characterizing Entities and the Harm)', 'value_json': '""Involved in the December 2015 event in Jennings, MO.""'}]}; {'attributes': [{'short_name': 'Entity', 'value_json': '""Gizmodo""'}, {'short_name': 'Named Entity', 'value_json': 'true'}, {'short_name': 'Entity type', 'value_json': '""for-profit organization""'}, {'short_name': 'Entity Relationship to the AI', 'value_json': '[""watchdog"",""researcher""]'}, {'short_name': 'Harm Category Experienced', 'value_json': '""not applicable""'}, {'short_name': 'Harm Type Experienced', 'value_json': '""not applicable""'}]}; {'attributes': [{'short_name': 'Entity', 'value_json': '""Richmond Police Department""'}, {'short_name': 'Named Entity', 'value_json': 'true'}, {'short_name': 'Entity type', 'value_json': '""government entity""'}, {'short_name': 'Entity Relationship to the AI', 'value_json': '[""deployer"",""user""]'}, {'short_name': 'Harm Category Experienced', 'value_json': '""not applicable""'}, {'short_name': 'Harm Type Experienced', 'value_json': '""not applicable""'}, {'short_name': 'Notes (Characterizing Entities and the Harm)', 'value_json': '""Involved in the 2016 event in Richmond, VA""'}]}",0,0,False,,"PredPol takes in past crime data and spits out predictions about where future crimes are more likely to occur. It turns those predictions into 500 by 500 foot red boxes on a Google map, indicating areas that police officers should patrol when they're not actively responding to a call. 

HunchLab surveys past crimes and also digs into other factors like population density; census data; the location of bars, churches, schools, and transportation hubs; schedules for home games - even moon phases to determine where patrols would have the most impact.",Crime Records; geospatial data; past type of crime; past location of crime; past time of crime; population density; census data; maps; patrol shifts,,,Predict Crimes; predictive policing,
55,Alexa Plays Pornography Instead of Kids Song,2016-12-30,amazon,amazon,children,none,"Arts, entertainment and recreation; information and communication",no,no,no,yes,no,no,no,no,yes,"no tangible harm, near-miss, or issue",yes,yes,True,none,no,no,yes,yes,no,yes,True,yes,no,Autonomy2,No. Not intentionally designed to perform harm,Audio Transcription; voice recognition; natural language processing; text to speech,002,False,6. Complete and final,55,002,,Alexa produced inappropriate response/content for child user.,yes,,2016,12,,False,no,yes,,,US,North America,,unclear enunciation,,"{'attributes': [{'short_name': 'Entity', 'value_json': '""Amazon Alexa""'}, {'short_name': 'Named Entity', 'value_json': 'true'}, {'short_name': 'Entity type', 'value_json': '""product""'}, {'short_name': 'Entity Relationship to the AI', 'value_json': '[""product containing AI""]'}, {'short_name': 'Harm Category Experienced', 'value_json': '""not applicable""'}, {'short_name': 'Harm Type Experienced', 'value_json': '""not applicable""'}]}; {'attributes': [{'short_name': 'Entity', 'value_json': '""Amazon""'}, {'short_name': 'Named Entity', 'value_json': 'true'}, {'short_name': 'Entity type', 'value_json': '""for-profit organization""'}, {'short_name': 'Entity Relationship to the AI', 'value_json': '[""developer""]'}, {'short_name': 'Harm Category Experienced', 'value_json': '""not applicable""'}, {'short_name': 'Harm Type Experienced', 'value_json': '""not applicable""'}]}; {'attributes': [{'short_name': 'Entity', 'value_json': '""William""'}, {'short_name': 'Named Entity', 'value_json': 'true'}, {'short_name': 'Entity type', 'value_json': '""individual""'}, {'short_name': 'Entity Relationship to the AI', 'value_json': '[""user""]'}, {'short_name': 'Harm Category Experienced', 'value_json': '""AI special interest intangible harm""'}, {'short_name': 'Harm Type Experienced', 'value_json': '""detrimental content""'}, {'short_name': 'Notes (Characterizing Entities and the Harm)', 'value_json': '""William, a minor, was (nearly) exposed to detrimental, pornographic content because the Amazon Alexa misunderstood his request.""'}]}",0,0,False,,Amazon Alexa is a digital assistant embedded in a bluetooth speaker ,voice; audio; personal data; speech,"9.5 - Humans can tell Alexa to stop in the middle of the response, but they did not do so quickly enough to prevent the harm from having happened.",Amazon Echo Dot Smart Speaker,virtual assistant technology,
56,AI-Designed Phone Cases Are Unexpected,2017-07-10,my_handy_design,my_handy_design,my_handy_design,none,wholesale and retail trade,yes,no,no,yes,no,no,no,no,yes,"no tangible harm, near-miss, or issue",maybe,yes,True,none,no,no,no,no,no,yes,True,no,no,Autonomy1,No. Not intentionally designed to perform harm,,002,False,6. Complete and final,56,002,AI system or bot used to create phone cases. ,"Although the phone cases may be strange and unusual, there was no harm.",no,,2017,07,08,False,no,no,,,,Global,,,,"{'attributes': [{'short_name': 'Entity', 'value_json': '""Amazon""'}, {'short_name': 'Named Entity', 'value_json': 'true'}, {'short_name': 'Entity type', 'value_json': '""for-profit organization""'}, {'short_name': 'Entity Relationship to the AI', 'value_json': '[""platform""]'}, {'short_name': 'Harm Category Experienced', 'value_json': '""not applicable""'}, {'short_name': 'Harm Type Experienced', 'value_json': '""not applicable""'}]}; {'attributes': [{'short_name': 'Entity', 'value_json': '""my-handy-design bot""'}, {'short_name': 'Named Entity', 'value_json': 'false'}, {'short_name': 'Entity type', 'value_json': '""other""'}, {'short_name': 'Notes (Characterizing Entities and the Harm)', 'value_json': '""""'}, {'short_name': 'Entity Relationship to the AI', 'value_json': '[""AI""]'}, {'short_name': 'Harm Category Experienced', 'value_json': '""not applicable""'}, {'short_name': 'Harm Type Experienced', 'value_json': '""not applicable""'}]}",0,0,False,,"It is suspected that the my-handy-design bot was scraping the web for popular images by search term, and then creating phone cases with those images to sell on Amazon. Each case is probably printed to order.",search terms; images,,,Design Phone Cases,
57,Australian Automated Debt Assessment System Issued False Notices to Thousands,2015-07-01,centrelink,australian-department-of-human-services,australian-welfare-recipients,none,public administration,no,no,no,yes,no,no,no,no,yes,tangible harm definitively occurred,no,yes,True,none,yes,yes,no,no,no,yes,True,no,yes,Autonomy1,No. Not intentionally designed to perform harm,,002,False,6. Complete and final,57,002,"The system in question does not meet the CSET definition for AI. It is likely purely and automation, or a rules-based system without machine learning components. 
",Access to social welfare (a public service) was interfered with.,yes,,2016,07,,True,no,no,,,AU,Oceania,,,,"{'attributes': [{'short_name': 'Entity', 'value_json': '""Centrelink""'}, {'short_name': 'Named Entity', 'value_json': 'true'}, {'short_name': 'Entity type', 'value_json': '""for-profit organization""'}, {'short_name': 'Entity Relationship to the AI', 'value_json': '[""developer""]'}, {'short_name': 'Harm Category Experienced', 'value_json': '""not applicable""'}, {'short_name': 'Harm Type Experienced', 'value_json': '""not applicable""'}]}; {'attributes': [{'short_name': 'Entity', 'value_json': '""Centrelink \'RoboDebt\' system""'}, {'short_name': 'Named Entity', 'value_json': 'false'}, {'short_name': 'Entity type', 'value_json': '""product""'}, {'short_name': 'Entity Relationship to the AI', 'value_json': '[""product not containing AI""]'}, {'short_name': 'Harm Category Experienced', 'value_json': '""not applicable""'}, {'short_name': 'Harm Type Experienced', 'value_json': '""not applicable""'}]}; {'attributes': [{'short_name': 'Entity', 'value_json': '""Australian Department of Human Services""'}, {'short_name': 'Named Entity', 'value_json': 'true'}, {'short_name': 'Entity type', 'value_json': '""government entity""'}, {'short_name': 'Entity Relationship to the AI', 'value_json': '[""deployer""]'}, {'short_name': 'Harm Category Experienced', 'value_json': '""not applicable""'}, {'short_name': 'Harm Type Experienced', 'value_json': '""not applicable""'}]}; {'attributes': [{'short_name': 'Entity', 'value_json': '""Australian welfare recipients""'}, {'short_name': 'Named Entity', 'value_json': 'false'}, {'short_name': 'Entity type', 'value_json': '""group of individuals""'}, {'short_name': 'Entity Relationship to the AI', 'value_json': '[""affected non-user""]'}, {'short_name': 'Notes (Characterizing Entities and the Harm)', 'value_json': '""7.5 and 7.6 - Users experienced financial loss when the system incorrectly identified the debts they owed, but the system was not AI so the harm does not meet CSET definitions.""'}, {'short_name': 'Harm Category Experienced', 'value_json': '""Other harm not meeting CSET definitions""'}, {'short_name': 'Harm Type Experienced', 'value_json': '""financial loss""'}]}; {'attributes': [{'short_name': 'Entity', 'value_json': '""Australian welfare recipients""'}, {'short_name': 'Named Entity', 'value_json': 'false'}, {'short_name': 'Entity type', 'value_json': '""group of individuals""'}, {'short_name': 'Entity Relationship to the AI', 'value_json': '[""affected non-user""]'}, {'short_name': 'Harm Category Experienced', 'value_json': '""Other harm not meeting CSET definitions""'}, {'short_name': 'Harm Type Experienced', 'value_json': '""violation of human rights, civil liberties, civil rights, or democratic norms""'}, {'short_name': 'Notes (Characterizing Entities and the Harm)', 'value_json': '""7.5 and 7.6 - Those accused of misreporting their income lost access to government benefits. ""'}]}",0,0,False,,Automated tax and welfare compliance system. ,income data; tax reports; tabular,,,,not AI
58,Russian Chatbot Supports Stalin and Violence,2017-10-12,yandex,yandex,yandex-users,sexual orientation or gender identity; ideology; race,information and communication,no,no,no,yes,no,no,no,no,yes,"no tangible harm, near-miss, or issue",yes,yes,False,none,no,no,no,yes,yes,yes,True,yes,no,Autonomy1,No. Not intentionally designed to perform harm,speech recognition; natural language processing,002,False,4. Peer review complete,58,,,"4.4 and 4.5 - Yandex's chatbot Alice expressed views supporting shooting Russia's ""enemies of the people,"" self-harm, opposing gay marriage, opposing diversity, and suggesting people should put up with domestic violence. These sentiments are classified as detrimental content and indicate Alice's bias against protected groups.",yes,,2017,10,10,False,no,no,,,RU,Europe,,,,"{'attributes': [{'short_name': 'Entity', 'value_json': '""Users of Alice""'}, {'short_name': 'Named Entity', 'value_json': 'false'}, {'short_name': 'Entity type', 'value_json': '""group of individuals""'}, {'short_name': 'Entity Relationship to the AI', 'value_json': '[""user""]'}, {'short_name': 'Harm Category Experienced', 'value_json': '""AI special interest intangible harm""'}, {'short_name': 'Harm Type Experienced', 'value_json': '""disproportionate treatment based upon a protected characteristic""'}, {'short_name': 'Notes (Characterizing Entities and the Harm)', 'value_json': '""Yandex\'s chatbot Alice expressed views supporting shooting Russia\'s \\""enemies of the people,\\"" opposing gay marriage, and suggesting people should put up with domestic violence. These sentiments are classified as detrimental content and indicate Alice\'s bias against protected groups like gay people.""'}]}; {'attributes': [{'short_name': 'Entity', 'value_json': '""Misha Bilenko""'}, {'short_name': 'Named Entity', 'value_json': 'true'}, {'short_name': 'Entity type', 'value_json': '""individual""'}, {'short_name': 'Notes (Characterizing Entities and the Harm)', 'value_json': '""head of the Machine Intelligence and Research (MIR) department at Yandex""'}, {'short_name': 'Harm Type Experienced', 'value_json': '""not applicable""'}, {'short_name': 'Harm Category Experienced', 'value_json': '""not applicable""'}, {'short_name': 'Entity Relationship to the AI', 'value_json': '[""researcher"",""developer""]'}]}; {'attributes': [{'short_name': 'Entity', 'value_json': '""Yandex""'}, {'short_name': 'Named Entity', 'value_json': 'true'}, {'short_name': 'Entity type', 'value_json': '""for-profit organization""'}, {'short_name': 'Entity Relationship to the AI', 'value_json': '[""developer"",""deployer""]'}, {'short_name': 'Harm Category Experienced', 'value_json': '""not applicable""'}, {'short_name': 'Harm Type Experienced', 'value_json': '""not applicable""'}]}; {'attributes': [{'short_name': 'Entity', 'value_json': '""Alice""'}, {'short_name': 'Named Entity', 'value_json': 'true'}, {'short_name': 'Entity type', 'value_json': '""product""'}, {'short_name': 'Entity Relationship to the AI', 'value_json': '[""AI""]'}, {'short_name': 'Harm Category Experienced', 'value_json': '""not applicable""'}, {'short_name': 'Harm Type Experienced', 'value_json': '""not applicable""'}, {'short_name': 'Notes (Characterizing Entities and the Harm)', 'value_json': '""Russian chatbot""'}]}; {'attributes': [{'short_name': 'Entity', 'value_json': '""SpeechKit""'}, {'short_name': 'Named Entity', 'value_json': 'true'}, {'short_name': 'Entity type', 'value_json': '""product""'}, {'short_name': 'Entity Relationship to the AI', 'value_json': '[""AI""]'}, {'short_name': 'Harm Category Experienced', 'value_json': '""not applicable""'}, {'short_name': 'Harm Type Experienced', 'value_json': '""not applicable""'}]}; {'attributes': [{'short_name': 'Entity', 'value_json': '""Users of Alice""'}, {'short_name': 'Named Entity', 'value_json': 'false'}, {'short_name': 'Entity type', 'value_json': '""group of individuals""'}, {'short_name': 'Entity Relationship to the AI', 'value_json': '[""user""]'}, {'short_name': 'Harm Category Experienced', 'value_json': '""AI special interest intangible harm""'}, {'short_name': 'Harm Type Experienced', 'value_json': '""detrimental content""'}, {'short_name': 'Notes (Characterizing Entities and the Harm)', 'value_json': '""Within weeks of being released, it was discovered that the Alice chatbot had some pro-Stalin and pro-violence content.""'}]}",0,0,False,,Russian-language A chatbot called Alice ,speech; audio inputs; Text,,,voice recognition; speech interpretation; virtual assistant technology; chatbot,
