164,"Facebook ""News Feed"" Allegedly Boosted Misinformation and Violating Content Following Use of MSI Metric",2018-10-01,facebook,facebook,"facebook-users, facebook-content-creators",none,information and communication,no,maybe,no,yes,no,no,no,no,yes,tangible harm definitively occurred,yes,yes,True,AI tangible harm event,no,no,no,yes,no,yes,True,yes,no,Autonomy1,No. Not intentionally designed to perform harm,,001,False,3. In peer review,164,,,"The new algorithm’s heavy weighting of reshared material in its News Feed resulted in more harmful content on users' News Feeds overall, because misinformation, toxicity, and violent content are inordinately prevalent among reshares. ",yes,,2018,01,,True,no,no,,,,Global,,,,"{'attributes': [{'short_name': 'Entity', 'value_json': '""Facebook users""'}, {'short_name': 'Named Entity', 'value_json': 'false'}, {'short_name': 'Entity type', 'value_json': '""group of individuals""'}, {'short_name': 'Entity Relationship to the AI', 'value_json': '[""user""]'}, {'short_name': 'Harm Category Experienced', 'value_json': '""AI special interest intangible harm""'}, {'short_name': 'Harm Type Experienced', 'value_json': '""detrimental content""'}, {'short_name': 'Notes (Characterizing Entities and the Harm)', 'value_json': '""Facebook users may experience more incendiary, anger-provoking, and sensational content because Facebook\'s algorithm seeks reactions and interaction.""'}]}; {'attributes': [{'short_name': 'Entity', 'value_json': '""The Wall Street Journal""'}, {'short_name': 'Named Entity', 'value_json': 'true'}, {'short_name': 'Entity type', 'value_json': '""for-profit organization""'}, {'short_name': 'Entity Relationship to the AI', 'value_json': '[""researcher"",""watchdog""]'}, {'short_name': 'Harm Category Experienced', 'value_json': '""not applicable""'}, {'short_name': 'Harm Type Experienced', 'value_json': '""not applicable""'}]}; {'attributes': [{'short_name': 'Entity', 'value_json': '""Facebook""'}, {'short_name': 'Named Entity', 'value_json': 'true'}, {'short_name': 'Entity type', 'value_json': '""product""'}, {'short_name': 'Entity Relationship to the AI', 'value_json': '[""product containing AI""]'}, {'short_name': 'Harm Category Experienced', 'value_json': '""not applicable""'}, {'short_name': 'Harm Type Experienced', 'value_json': '""not applicable""'}]}; {'attributes': [{'short_name': 'Entity', 'value_json': '""Meta""'}, {'short_name': 'Named Entity', 'value_json': 'true'}, {'short_name': 'Entity type', 'value_json': '""for-profit organization""'}, {'short_name': 'Entity Relationship to the AI', 'value_json': '[""developer"",""deployer""]'}, {'short_name': 'Harm Category Experienced', 'value_json': '""not applicable""'}, {'short_name': 'Harm Type Experienced', 'value_json': '""not applicable""'}]}; {'attributes': [{'short_name': 'Entity', 'value_json': '""News Feed algorithm""'}, {'short_name': 'Named Entity', 'value_json': 'false'}, {'short_name': 'Entity type', 'value_json': '""product""'}, {'short_name': 'Entity Relationship to the AI', 'value_json': '[""AI""]'}, {'short_name': 'Harm Category Experienced', 'value_json': '""not applicable""'}, {'short_name': 'Harm Type Experienced', 'value_json': '""not applicable""'}, {'short_name': 'Notes (Characterizing Entities and the Harm)', 'value_json': '""An overhaul of the algorithm was meant to boost Meaningful Social Interactions (MSI) on the platform. ""'}]}; {'attributes': [{'short_name': 'Entity', 'value_json': '""BuzzFeed""'}, {'short_name': 'Named Entity', 'value_json': 'true'}, {'short_name': 'Entity type', 'value_json': '""for-profit organization""'}, {'short_name': 'Entity Relationship to the AI', 'value_json': '[""affected non-user""]'}, {'short_name': 'Harm Category Experienced', 'value_json': '""AI tangible harm event""'}, {'short_name': 'Harm Type Experienced', 'value_json': '""financial loss""'}]}; {'attributes': [{'short_name': 'Entity', 'value_json': '""Meta\'s Integrity Team""'}, {'short_name': 'Named Entity', 'value_json': 'true'}, {'short_name': 'Entity type', 'value_json': '""group of individuals""'}, {'short_name': 'Entity Relationship to the AI', 'value_json': '[""researcher""]'}, {'short_name': 'Harm Category Experienced', 'value_json': '""not applicable""'}, {'short_name': 'Harm Type Experienced', 'value_json': '""not applicable""'}]}; {'attributes': [{'short_name': 'Entity', 'value_json': '""Breitbart News""'}, {'short_name': 'Named Entity', 'value_json': 'true'}, {'short_name': 'Entity type', 'value_json': '""for-profit organization""'}, {'short_name': 'Entity Relationship to the AI', 'value_json': '[""affected non-user""]'}, {'short_name': 'Harm Category Experienced', 'value_json': '""AI tangible harm event""'}, {'short_name': 'Harm Type Experienced', 'value_json': '""financial loss""'}]}; {'attributes': [{'short_name': 'Entity', 'value_json': '""ABC News""'}, {'short_name': 'Named Entity', 'value_json': 'true'}, {'short_name': 'Entity type', 'value_json': '""for-profit organization""'}, {'short_name': 'Entity Relationship to the AI', 'value_json': '[""affected non-user""]'}, {'short_name': 'Harm Category Experienced', 'value_json': '""AI tangible harm event""'}, {'short_name': 'Harm Type Experienced', 'value_json': '""financial loss""'}]}; {'attributes': [{'short_name': 'Entity', 'value_json': '""Topix""'}, {'short_name': 'Named Entity', 'value_json': 'true'}, {'short_name': 'Entity type', 'value_json': '""for-profit organization""'}, {'short_name': 'Entity Relationship to the AI', 'value_json': '[""affected non-user""]'}, {'short_name': 'Harm Category Experienced', 'value_json': '""AI tangible harm event""'}, {'short_name': 'Harm Type Experienced', 'value_json': '""financial loss""'}]}; {'attributes': [{'short_name': 'Entity', 'value_json': '""Facebook users from Poland, Spain, India or Taiwan""'}, {'short_name': 'Named Entity', 'value_json': 'false'}, {'short_name': 'Entity type', 'value_json': '""group of individuals""'}, {'short_name': 'Entity Relationship to the AI', 'value_json': '[""user""]'}, {'short_name': 'Harm Category Experienced', 'value_json': '""Other harm not meeting CSET definitions""'}, {'short_name': 'Harm Type Experienced', 'value_json': '""social or political systems""'}, {'short_name': 'Notes (Characterizing Entities and the Harm)', 'value_json': '""The algorithm change had a direct effect on the online political debate in Poland, Spain, Taiwan, India""'}]}",0,0,False,,Algorithm determining the content shown on a Facebook user's News Feed ,Facebook posts; Facebook reactions; Facebook likes; Facebook comments; Facebook reshares; text; images; user engagement; user comments,,,content recommendation; prediction; engagement optimization,
204,A Chinese Tech Worker at Zhihu Fired Allegedly via a Resignation Risk Prediction Algorithm,2022-02-11,sangfor-technologies,zhihu,"zhihu-employees, chinese-tech-workers",,,,,,,,,,,,,,,False,,,,,,,,False,,,,,,,False,--,0,,,,,,,,,False,,,,,,Eastern and South-Eastern Asia,,,,,0,0,False,,,,,,,
205,AI-Generated Profiles Used in Disinformation Campaign Targeting Ukrainians,2022-02-25,unknown,"individuals-in-the-donbass-region, individuals-in-russia, media-organizations-in-crimea",ukrainian-social-media-users,"nation of origin, citizenship, immigrant status; geography","Arts, entertainment and recreation; information and communication",no,maybe,no,yes,no,no,no,no,no,"no tangible harm, near-miss, or issue",no,yes,False,none,no,no,no,yes,yes,yes,True,no,no,Autonomy3,unclear,,001,False,4. Peer review complete,205,,,,yes, 5.5 - no AI was involved. Hackers gained access to Facebook and Instagram accounts through phishing. ,2022,02,  ,False,no,no,,,,Europe,,,6.10 - Russia and Ukraine,"{'attributes': [{'short_name': 'Entity', 'value_json': '""Facebook""'}, {'short_name': 'Named Entity', 'value_json': 'true'}, {'short_name': 'Entity type', 'value_json': '""product""'}, {'short_name': 'Entity Relationship to the AI', 'value_json': '[""platform"",""deployer""]'}, {'short_name': 'Harm Category Experienced', 'value_json': '""not applicable""'}, {'short_name': 'Harm Type Experienced', 'value_json': '""not applicable""'}]}; {'attributes': [{'short_name': 'Entity', 'value_json': '""Instagram""'}, {'short_name': 'Named Entity', 'value_json': 'true'}, {'short_name': 'Entity type', 'value_json': '""product""'}, {'short_name': 'Entity Relationship to the AI', 'value_json': '[""platform"",""deployer""]'}, {'short_name': 'Harm Category Experienced', 'value_json': '""not applicable""'}, {'short_name': 'Harm Type Experienced', 'value_json': '""not applicable""'}]}; {'attributes': [{'short_name': 'Entity', 'value_json': '""Meta""'}, {'short_name': 'Named Entity', 'value_json': 'true'}, {'short_name': 'Entity type', 'value_json': '""for-profit organization""'}, {'short_name': 'Entity Relationship to the AI', 'value_json': '[""developer""]'}, {'short_name': 'Harm Category Experienced', 'value_json': '""not applicable""'}, {'short_name': 'Harm Type Experienced', 'value_json': '""not applicable""'}]}; {'attributes': [{'short_name': 'Entity', 'value_json': '""Ghostwriter""'}, {'short_name': 'Named Entity', 'value_json': 'true'}, {'short_name': 'Entity type', 'value_json': '""other""'}, {'short_name': 'Notes (Characterizing Entities and the Harm)', 'value_json': '""7.3 - threat actor, hacking organization""'}, {'short_name': 'Entity Relationship to the AI', 'value_json': '[""deployer"",""user""]'}, {'short_name': 'Harm Category Experienced', 'value_json': '""not applicable""'}, {'short_name': 'Harm Type Experienced', 'value_json': '""not applicable""'}]}; {'attributes': [{'short_name': 'Entity', 'value_json': '""Hacked Facebook and Instagram users""'}, {'short_name': 'Named Entity', 'value_json': 'false'}, {'short_name': 'Entity type', 'value_json': '""group of individuals""'}, {'short_name': 'Entity Relationship to the AI', 'value_json': '[""user""]'}, {'short_name': 'Harm Category Experienced', 'value_json': '""Other harm not meeting CSET definitions""'}, {'short_name': 'Harm Type Experienced', 'value_json': '""other intangible harm""'}]}; {'attributes': [{'short_name': 'Entity', 'value_json': '""Facebook, Instagram, Twitter, Youtube, Telegram, Odnoklassniki, and VK users""'}, {'short_name': 'Named Entity', 'value_json': 'false'}, {'short_name': 'Entity type', 'value_json': '""group of individuals""'}, {'short_name': 'Entity Relationship to the AI', 'value_json': '[""user""]'}, {'short_name': 'Harm Category Experienced', 'value_json': '""Other harm not meeting CSET definitions""'}, {'short_name': 'Harm Type Experienced', 'value_json': '""detrimental content""'}]}",0,0,False,,"Hacking group Ghostwriter used Facebook to target public figures in Ukraine. Hackers successfully gained access to targets' social media accounts and attempted to post YouTube videos from them portraying Ukrainian troops as weakened. In a separate influence campaign, individuals used a number of fictitious personas to run websites masquerading as independent news outlets to publish claims about the West betraying Ukraine and Ukraine being a failed state.",social media accounts; Facebook accounts; Instagram accounts,,,,"no AI - AI was only used by the hackers to generate fake profile pictures, which is not the main harm in this incident"
208,"Tesla Phantom Braking Complaints Surged, Allegedly Linked to Tesla Vision Rollout",2021-05-01,tesla,tesla,tesla-drivers,,,,,,,,,,,,,,,False,,,,,,,,False,,,,,,,False,--,0,,,,,,,,,False,,,,,,Europe and Northern America,,,,,0,0,False,,,,,,,
210,Indian Political App Tek Fog Allegedly Hijacked Trends and Manipulated Public Opinion on Other Social Media Platforms,2020-04-28,persistent-systems,bharatiya-janata-yuva-morcha,"indian-voters, indian-social-media-users, indian-women-journalists",,,,,,,,,,,,,,,False,,,,,,,,False,,,,,,001,False,6. Complete and final,210,,,,,,,,,False,,,,,,,,,,,,,False,,,,,,,
214,SN Technologies Reportedly Lied to a New York State School District about Its Facial and Weapon Detection Systems’ Performance,2020-01-02,sn-technologies,lockport-city-school-district,black-students,race,Education; law enforcement; public administration,yes,no,no,yes,no,no,no,no,yes,imminent risk of tangible harm (near miss) did occur,yes,yes,True,AI tangible harm near-miss,no,yes,yes,no,yes,yes,True,yes,yes,unclear,No. Not intentionally designed to perform harm,facial recognition,001,False,4. Peer review complete,214,,,,yes,,2020,01, ,False,no,yes,New York,NY,US,North America,,,,"{'attributes': [{'short_name': 'Entity', 'value_json': '""Lockport City School District""'}, {'short_name': 'Named Entity', 'value_json': 'true'}, {'short_name': 'Entity type', 'value_json': '""other""'}, {'short_name': 'Notes (Characterizing Entities and the Harm)', 'value_json': '""7.3 - school district""'}, {'short_name': 'Entity Relationship to the AI', 'value_json': '[""deployer"",""user""]'}, {'short_name': 'Harm Category Experienced', 'value_json': '""not applicable""'}, {'short_name': 'Harm Type Experienced', 'value_json': '""not applicable""'}]}; {'attributes': [{'short_name': 'Entity', 'value_json': '""SN Technologies""'}, {'short_name': 'Named Entity', 'value_json': 'true'}, {'short_name': 'Entity type', 'value_json': '""for-profit organization""'}, {'short_name': 'Entity Relationship to the AI', 'value_json': '[""installer"",""developer""]'}, {'short_name': 'Harm Category Experienced', 'value_json': '""not applicable""'}, {'short_name': 'Harm Type Experienced', 'value_json': '""not applicable""'}]}; {'attributes': [{'short_name': 'Entity', 'value_json': '""AEGIS face and weapons detection system""'}, {'short_name': 'Named Entity', 'value_json': 'false'}, {'short_name': 'Entity type', 'value_json': '""product""'}, {'short_name': 'Entity Relationship to the AI', 'value_json': '[""AI"",""product containing AI""]'}, {'short_name': 'Harm Category Experienced', 'value_json': '""not applicable""'}, {'short_name': 'Harm Type Experienced', 'value_json': '""not applicable""'}, {'short_name': 'Notes (Characterizing Entities and the Harm)', 'value_json': '""SN Technologies\' AEGIS face and weapons detection system was prone to misidentifying objects like broom handles as guns.""'}]}; {'attributes': [{'short_name': 'Entity', 'value_json': '""Lockport City School District students""'}, {'short_name': 'Named Entity', 'value_json': 'false'}, {'short_name': 'Entity type', 'value_json': '""group of individuals""'}, {'short_name': 'Entity Relationship to the AI', 'value_json': '[""affected non-users""]'}, {'short_name': 'Harm Category Experienced', 'value_json': '""AI tangible harm issue""'}, {'short_name': 'Harm Type Experienced', 'value_json': '""physical health/safety""'}]}; {'attributes': [{'short_name': 'Entity', 'value_json': '""id3 Technologies""'}, {'short_name': 'Named Entity', 'value_json': 'true'}, {'short_name': 'Entity type', 'value_json': '""for-profit organization""'}, {'short_name': 'Entity Relationship to the AI', 'value_json': '[""developer""]'}, {'short_name': 'Harm Category Experienced', 'value_json': '""not applicable""'}, {'short_name': 'Harm Type Experienced', 'value_json': '""not applicable""'}]}; {'attributes': [{'short_name': 'Entity', 'value_json': '""Dark Skinned Lockport City School District Students""'}, {'short_name': 'Named Entity', 'value_json': 'false'}, {'short_name': 'Entity type', 'value_json': '""group of individuals""'}, {'short_name': 'Entity Relationship to the AI', 'value_json': '[""affected non-user""]'}, {'short_name': 'Harm Category Experienced', 'value_json': '""AI special interest intangible harm""'}, {'short_name': 'Harm Type Experienced', 'value_json': '""disproportionate treatment based upon a protected characteristic""'}]}; {'attributes': [{'short_name': 'Entity', 'value_json': '""Lockport City School District Students""'}, {'short_name': 'Named Entity', 'value_json': 'false'}, {'short_name': 'Entity type', 'value_json': '""group of individuals""'}, {'short_name': 'Entity Relationship to the AI', 'value_json': '[""affected non-user""]'}, {'short_name': 'Harm Category Experienced', 'value_json': '""AI special interest intangible harm""'}, {'short_name': 'Harm Type Experienced', 'value_json': '""violation of human rights, civil liberties, civil rights, or democratic norms""'}]}",0,0,False,,SN Technologies' weapons and facial recognition software uses facial recognition to surveil students and identify objects within the school to see if they are guns or not. It was found that these systems reported a lot of false alarms.,video input; camera footage,"“The police have said if they get a notification, they’re going to treat it as a live shooter system, and you have a system that’s predisposed to make mistakes and misidentify people,” This treatment could be seen as effectively making the autonomy level 1, but in other cases, it acts with less autonomy.",,facial recognition; object detection; weapons detection,
220,Facebook Mistakenly Blocked Small Business Ads,2020-11-11,facebook,facebook,small-businesses-on-facebook,financial means,wholesale and retail trade; information and communication,no,no,no,yes,no,no,no,no,yes,tangible harm definitively occurred,yes,yes,True,AI tangible harm event,no,no,no,no,maybe,yes,True,maybe,no,Autonomy1,No. Not intentionally designed to perform harm,,001,False,4. Peer review complete,220,,,Primarily small to medium-sized business owners were affected.,maybe,,2020,11, ,False,no,no,,,,Global,,,"Facebook switched to relying more heavily on artificial intelligence to police its platform after the COVID-19 pandemic began in March 2020. However, users mainly started reporting their ads being unjustly taken down in November 2020.","{'attributes': [{'short_name': 'Entity', 'value_json': '""Facebook (now Meta)""'}, {'short_name': 'Named Entity', 'value_json': 'true'}, {'short_name': 'Entity type', 'value_json': '""for-profit organization""'}, {'short_name': 'Entity Relationship to the AI', 'value_json': '[""developer"",""deployer"",""platform of use""]'}, {'short_name': 'Harm Category Experienced', 'value_json': '""not applicable""'}, {'short_name': 'Harm Type Experienced', 'value_json': '""not applicable""'}]}; {'attributes': [{'short_name': 'Entity', 'value_json': '""Facebook automated spam filters""'}, {'short_name': 'Named Entity', 'value_json': 'false'}, {'short_name': 'Entity type', 'value_json': '""product""'}, {'short_name': 'Entity Relationship to the AI', 'value_json': '[""AI"",""product containing AI""]'}, {'short_name': 'Harm Category Experienced', 'value_json': '""not applicable""'}, {'short_name': 'Harm Type Experienced', 'value_json': '""not applicable""'}]}; {'attributes': [{'short_name': 'Entity', 'value_json': '""Small and mediaum businesses on Facebook""'}, {'short_name': 'Named Entity', 'value_json': 'false'}, {'short_name': 'Entity type', 'value_json': '""for-profit organization""'}, {'short_name': 'Entity Relationship to the AI', 'value_json': '[""affected non-users""]'}, {'short_name': 'Harm Category Experienced', 'value_json': '""AI tangible harm event""'}, {'short_name': 'Harm Type Experienced', 'value_json': '""financial loss""'}, {'short_name': 'Notes (Characterizing Entities and the Harm)', 'value_json': '""""'}]}; {'attributes': [{'short_name': 'Entity', 'value_json': '""Advertisers on Facebook""'}, {'short_name': 'Named Entity', 'value_json': 'false'}, {'short_name': 'Entity type', 'value_json': '""for-profit organization""'}, {'short_name': 'Entity Relationship to the AI', 'value_json': '[""affected non-users""]'}, {'short_name': 'Harm Category Experienced', 'value_json': '""AI tangible harm event""'}, {'short_name': 'Harm Type Experienced', 'value_json': '""financial loss""'}]}",0,0,False,,Facebook deploys automated spam filters to moderate content and take down ads/posts that violate its content policies. ,Facebook ads; Facebook posts,,,content moderation,
239,Algorithmic Teacher Evaluation Program Failed Student Outcome Goals and Allegedly Caused Harm Against Teachers,2009-09-01,intensive-partnerships-for-effective-teaching,intensive-partnerships-for-effective-teaching,"students, low-income-minority-students, teachers",none,Education,no,no,yes,yes,no,no,no,no,yes,tangible harm definitively occurred,maybe,maybe,True,unclear,no,no,no,no,no,maybe,True,no,yes,Autonomy3,unclear,,001,False,4. Peer review complete,239,,"3.1 - Some teachers were fired because of a negative assessment by the Gates Foundation's Intensive Partnerships for Effective Teaching value-added model. However, it is unclear that they would not have otherwise been fired for poor performance. Thus, there is an imminent risk that at least some of those teachers were unfairly fired because of their assessment by the algorithm.


Harm definitively occurred, but based on the information provided in the article, it is not clear that an AI is linked to the harm and not a non-AI (as defined by CSET) algorithm. ",,no,,2018,, ,True,no,no,, ,US,North America,,,,"{'attributes': [{'short_name': 'Entity', 'value_json': '""Bill & Melinda Gates Foundation""'}, {'short_name': 'Named Entity', 'value_json': 'true'}, {'short_name': 'Entity type', 'value_json': '""non-profit organization""'}, {'short_name': 'Entity Relationship to the AI', 'value_json': '[""developer"",""deployer""]'}, {'short_name': 'Harm Category Experienced', 'value_json': '""not applicable""'}, {'short_name': 'Harm Type Experienced', 'value_json': '""not applicable""'}]}; {'attributes': [{'short_name': 'Entity', 'value_json': '""Intensive Partnerships for Effective Teaching""'}, {'short_name': 'Named Entity', 'value_json': 'true'}, {'short_name': 'Entity type', 'value_json': '""product""'}, {'short_name': 'Entity Relationship to the AI', 'value_json': '[""value-added model"",""product containing non-AI algorithm""]'}, {'short_name': 'Harm Category Experienced', 'value_json': '""not applicable""'}, {'short_name': 'Harm Type Experienced', 'value_json': '""not applicable""'}]}; {'attributes': [{'short_name': 'Entity', 'value_json': '""Rand Corporation""'}, {'short_name': 'Named Entity', 'value_json': 'true'}, {'short_name': 'Entity type', 'value_json': '""non-profit organization""'}, {'short_name': 'Entity Relationship to the AI', 'value_json': '[""researcher"",""watchdog""]'}, {'short_name': 'Harm Category Experienced', 'value_json': '""not applicable""'}, {'short_name': 'Harm Type Experienced', 'value_json': '""not applicable""'}, {'short_name': 'Notes (Characterizing Entities and the Harm)', 'value_json': '""The Rand Corporation was hired to create an independent assessment of the Intensive Partnerships for Effective Teaching program.""'}]}; {'attributes': [{'short_name': 'Entity', 'value_json': '""Teachers assessed by the Intensive Partnerships for Effective Teaching program""'}, {'short_name': 'Named Entity', 'value_json': 'false'}, {'short_name': 'Entity type', 'value_json': '""group of individuals""'}, {'short_name': 'Entity Relationship to the AI', 'value_json': '[""affected non-users""]'}, {'short_name': 'Harm Category Experienced', 'value_json': '""Other harm not meeting CSET definitions""'}, {'short_name': 'Harm Type Experienced', 'value_json': '""financial loss""'}]}",0,0,False,,"The Intensive Partnerships for Effective Teaching program sought to ""improve education for low-income minority students... by gathering data and using an algorithm to assess teacher performance. It focused on measures such as test scores, the observations of school principals, and evaluations from students and parents to determine whether teachers were adding value.


Harm definitively occurred, but based on the information provided in the article, it is not clear that an AI is linked to the harm and not a non-AI (as defined by CSET) algorithm. ",test scores; school principal assessments; student evaluations,,,,no AI 
