109,PimEyes's Facial Recognition AI Allegedly Lacked Safeguards to Prevent Itself from Being Abused,2017-01-01,pimeyes,pimeyes,internet-users,none,"information and communication; Arts, entertainment and recreation",no,no,no,yes,no,no,no,no,yes,non-imminent risk of tangible harm (an issue) occurred,yes,yes,False,unclear,no,maybe,no,no,no,yes,False,maybe,no,Autonomy1,No. Not intentionally designed to perform harm,,001,False,4. Peer review complete,109,, The article notes the potential for nefarious actors like stalkers to use the PimEyes tool to do tangible harm.,,maybe,"Annotator 2: 

 It is unclear whether PimEyes violates peoples' privacy and whether or not that constitutes a rights violation.",2021, ,,False,no,no,,,,Global,,," 2021 represents the date when the article was posted, not necessarily PimEyes' date of development.","{'attributes': [{'short_name': 'Entity', 'value_json': '""PimEyes""'}, {'short_name': 'Named Entity', 'value_json': 'true'}, {'short_name': 'Entity type', 'value_json': '""for-profit organization""'}, {'short_name': 'Entity Relationship to the AI', 'value_json': '[""developer"",""deployer""]'}, {'short_name': 'Harm Category Experienced', 'value_json': '""not applicable""'}, {'short_name': 'Harm Type Experienced', 'value_json': '""not applicable""'}]}; {'attributes': [{'short_name': 'Entity', 'value_json': '""PimEyes facial recognition software""'}, {'short_name': 'Named Entity', 'value_json': 'false'}, {'short_name': 'Entity type', 'value_json': '""product""'}, {'short_name': 'Entity Relationship to the AI', 'value_json': '[""AI""]'}, {'short_name': 'Harm Category Experienced', 'value_json': '""not applicable""'}, {'short_name': 'Harm Type Experienced', 'value_json': '""not applicable""'}]}; {'attributes': [{'short_name': 'Entity', 'value_json': '""women""'}, {'short_name': 'Named Entity', 'value_json': 'false'}, {'short_name': 'Entity type', 'value_json': '""group of individuals""'}, {'short_name': 'Entity Relationship to the AI', 'value_json': '[""affected non-user""]'}, {'short_name': 'Harm Category Experienced', 'value_json': '""AI tangible harm issue""'}, {'short_name': 'Harm Type Experienced', 'value_json': '""physical health/safety""'}, {'short_name': 'Notes (Characterizing Entities and the Harm)', 'value_json': '""It is unclear what type of harm occurred because of this software. However, there is evidence that users of PimEyes use the software to salk women.""'}]}; {'attributes': [{'short_name': 'Entity', 'value_json': '""Lukasz Kowalczyk and Denis Tatina""'}, {'short_name': 'Named Entity', 'value_json': 'true'}, {'short_name': 'Entity type', 'value_json': '""group of individuals""'}, {'short_name': 'Entity Relationship to the AI', 'value_json': '[""developer""]'}, {'short_name': 'Harm Category Experienced', 'value_json': '""not applicable""'}, {'short_name': 'Harm Type Experienced', 'value_json': '""not applicable""'}]}",0,0,True,,"PimEyes is a face-searching tool that ""can scan through more than 900 million images from across the Internet and find matches with startling accuracy."" It uses bots known as ""spiders"" to crawl the Web, ""scanning for photos of faces and then recording those images as numerical code. If the search tool is later shown a photo that resembles one of those images, it will return a direct link to where the image can be found.""",images,,,facial recognition,
110,Arkansas's Opaque Algorithm to Allocate Health Care Excessively Cut Down Hours for Beneficiaries,2016-01-01,interrai,arkansas-department-of-human-services,"arkansas-medicaid-waiver-program-beneficiaries, arkansas-healthcare-workers",none,human health and social work activities,no,no,no,yes,no,no,no,no,yes,tangible harm definitively occurred,no,yes,True,none,yes,yes,no,no,no,yes,True,no,yes,Autonomy1,No. Not intentionally designed to perform harm,,002,False,4. Peer review complete,110,,"The report states that a patient in Idaho had to be hospitalized following the cut in at-home care hours assigned by the algorithm. However, the incident talks about an 'algorithm' and does not mention AI, Machine Learning, or models. It is likely an expert based on statistics serviced algorithm and therefore does not meet the CSET definition for AI.","Access to health care is a UN-defined human right. Therefore, this is a human rights violation--even if it does not meet the definition of CSET AI harm because CSET's definition for AI was not met.",yes,"The first incident just talks about an 'algorithm' and does not mention AI, Machine Learning, or models.  It is likely an expert based on statistics serviced algorithm and therefore, does not meet the CSET definition for AI. Therefore, it does not meet the CSET definition of AI intangible harm.",2011,,,False,no,no,,AR; ID,US,North America,healthcare and public health,,Idaho developed and implemented their algorithm to determine at-home care needs in 2011. Arkansas deployed their algorithm in 2016,"{'attributes': [{'short_name': 'Entity', 'value_json': '""InterRAI""'}, {'short_name': 'Named Entity', 'value_json': 'true'}, {'short_name': 'Entity type', 'value_json': '""non-profit organization""'}, {'short_name': 'Entity Relationship to the AI', 'value_json': '[""developer""]'}, {'short_name': 'Harm Category Experienced', 'value_json': '""not applicable""'}, {'short_name': 'Harm Type Experienced', 'value_json': '""not applicable""'}]}; {'attributes': [{'short_name': 'Entity', 'value_json': '""Idaho welfare recipients""'}, {'short_name': 'Named Entity', 'value_json': 'false'}, {'short_name': 'Entity type', 'value_json': '""group of individuals""'}, {'short_name': 'Entity Relationship to the AI', 'value_json': '[""affected non-users""]'}, {'short_name': 'Harm Category Experienced', 'value_json': '""Other harm not meeting CSET definitions""'}, {'short_name': 'Harm Type Experienced', 'value_json': '""violation of human rights, civil liberties, civil rights, or democratic norms""'}]}; {'attributes': [{'short_name': 'Entity', 'value_json': '""Bradley Ledgerwood""'}, {'short_name': 'Named Entity', 'value_json': 'true'}, {'short_name': 'Entity type', 'value_json': '""individual""'}, {'short_name': 'Entity Relationship to the AI', 'value_json': '[""affected non-user""]'}, {'short_name': 'Harm Category Experienced', 'value_json': '""Other harm not meeting CSET definitions""'}, {'short_name': 'Harm Type Experienced', 'value_json': '""violation of human rights, civil liberties, civil rights, or democratic norms""'}]}; {'attributes': [{'short_name': 'Entity', 'value_json': '""Tammy Dobbs""'}, {'short_name': 'Named Entity', 'value_json': 'true'}, {'short_name': 'Entity type', 'value_json': '""individual""'}, {'short_name': 'Entity Relationship to the AI', 'value_json': '[""affected non-user""]'}, {'short_name': 'Harm Category Experienced', 'value_json': '""Other harm not meeting CSET definitions""'}, {'short_name': 'Harm Type Experienced', 'value_json': '""violation of human rights, civil liberties, civil rights, or democratic norms""'}]}; {'attributes': [{'short_name': 'Entity', 'value_json': '""Arkansas Medicaid waiver program beneficiaries""'}, {'short_name': 'Named Entity', 'value_json': 'false'}, {'short_name': 'Entity type', 'value_json': '""group of individuals""'}, {'short_name': 'Entity Relationship to the AI', 'value_json': '[""affected non-user""]'}, {'short_name': 'Harm Category Experienced', 'value_json': '""Other harm not meeting CSET definitions""'}, {'short_name': 'Harm Type Experienced', 'value_json': '""violation of human rights, civil liberties, civil rights, or democratic norms""'}]}; {'attributes': [{'short_name': 'Entity', 'value_json': '""Arkansas Department of Human Services""'}, {'short_name': 'Named Entity', 'value_json': 'true'}, {'short_name': 'Entity type', 'value_json': '""government entity""'}, {'short_name': 'Entity Relationship to the AI', 'value_json': '[""deployer""]'}, {'short_name': 'Harm Category Experienced', 'value_json': '""not applicable""'}, {'short_name': 'Harm Type Experienced', 'value_json': '""not applicable""'}]}; {'attributes': [{'short_name': 'Entity', 'value_json': '""Arkansas healthcare workers""'}, {'short_name': 'Named Entity', 'value_json': 'false'}, {'short_name': 'Entity type', 'value_json': '""group of individuals""'}, {'short_name': 'Harm Category Experienced', 'value_json': '""not applicable""'}, {'short_name': 'Harm Type Experienced', 'value_json': '""not applicable""'}, {'short_name': 'Entity Relationship to the AI', 'value_json': '[""user""]'}]}; {'attributes': [{'short_name': 'Entity', 'value_json': '""Unnamed  beneficiary of the Medicaid waiver program""'}, {'short_name': 'Named Entity', 'value_json': 'false'}, {'short_name': 'Entity type', 'value_json': '""individual""'}, {'short_name': 'Entity Relationship to the AI', 'value_json': '[""affected non-user""]'}, {'short_name': 'Harm Category Experienced', 'value_json': '""Other harm not meeting CSET definitions""'}, {'short_name': 'Harm Type Experienced', 'value_json': '""physical health/safety""'}, {'short_name': 'Notes (Characterizing Entities and the Harm)', 'value_json': '""The report notes that an unnamed beneficiary of the waiver program was hospitalized because the algorithm had cut the hours of care they received. ""'}]}; {'attributes': [{'short_name': 'Entity', 'value_json': '""Legal Aid ""'}, {'short_name': 'Named Entity', 'value_json': 'true'}, {'short_name': 'Entity type', 'value_json': '""non-profit organization""'}, {'short_name': 'Notes (Characterizing Entities and the Harm)', 'value_json': '""Attorney Kevin De Liban represented patients in court against the use of the algorithm. ""'}, {'short_name': 'Entity Relationship to the AI', 'value_json': '[""watchdog""]'}, {'short_name': 'Harm Category Experienced', 'value_json': '""not applicable""'}, {'short_name': 'Harm Type Experienced', 'value_json': '""not applicable""'}]}",0,0,True,It is unclear how many injuries or hospitalizations were caused because of the hour cuts mandated by the algorithm,The algorithm allocates medicate services based on recipient data.,symptoms; health data,,,,
112,Police Departments Reported ShotSpotter as Unreliable and Wasteful,2012-10-09,shotspotter,"troy-police-department, syracuse-police-department, san-francisco-police-department, san-antonio-police-department, new-york-city-police-department, fall-river-police-department, chicago-police-department","troy-residents, troy-police-department, syracuse-residents, syracuse-police-department, san-francisco-residents, san-francisco-police-department, san-antonio-residents, san-antonio-police-department, new-york-city-residents, new-york-city-police-department, fall-river-residents, fall-river-police-department, chicago-residents, chicago-police-department",race; financial means; geography,law enforcement,yes,no,no,yes,no,no,no,no,yes,tangible harm definitively occurred,yes,yes,True,AI tangible harm event,yes,maybe,no,no,yes,yes,True,yes,yes,Autonomy3,No. Not intentionally designed to perform harm,,001,False,4. Peer review complete,112,," Many police departments that deployed ShotSpotter terminated expensive contracts because it was ineffective. The prominent harm in this incident is that ShotSpotter is ineffective: it wastes officers' time by prompting a response to shots fired calls that cannot be verified or are not gunfire. Often, it doesn’t result in more arrests or convictions. It increases policing in historically overpoliced neighborhoods. Microphones can record the conversations of people in these neighborhoods. However, these harms are not necessarily tangible.


 Several tangible harms have been reported in connection with the technology. 
1. Michael Williams spent a year in jail on murder charges based on evidence from ShotSpotter, before having his charges dismissed when prosecutors admitted they had insufficient evidence against him.
2. 13-year-old Adam Toledo was shot and killed by Chicago police after they were dispatched to his neighborhood in the early-morning hours of March 29 following a ShotSpotter alert. The boy was unarmed. 
3. The high false positive rate of the alerts leads to a significantly higher number of police deployments, and because officers expect to enter a dangerous situation with active shooters during these deployments, there is a reasonable probability that residents in affected neighborhoods experience harm to their health and safety. These residents are potentially identifiable because they have formed community activist groups fighting the use of these systems in their cities. 
4. Some police departments have determined that they sustained a financial lose because the expense of installing and using the system did not result in improved outcomes, while the systems did not come near to meeting the performance metrics promised by the sales and marketing department.","Investigations conducted by organizations like the ACLU have found that ShotSpotter false alarms send police on numerous trips into communities for no reason and on high alert.

Microphones are disproportionately installed in minority and low-income neighborhoods, increasing police engagement in those areas. ",yes,,2008,,,True,no,maybe,,,US,North America,,," The ShotSpotter technology has been deployed in more than 130 cities across the US, as of March 2022. The earliest use mentioned in the reports goes back to 2008 by the San Francisco PD. 

It is unclear if there is AI in the sensors that are installed in neighborhoods (i.e. 'embedded AI') or if the AI processing occurs on software installed outside of the microphones--or both options are occurring.","{'attributes': [{'short_name': 'Entity', 'value_json': '""ShotSpotter""'}, {'short_name': 'Named Entity', 'value_json': 'true'}, {'short_name': 'Entity type', 'value_json': '""product""'}, {'short_name': 'Entity Relationship to the AI', 'value_json': '[""product containing AI""]'}, {'short_name': 'Harm Category Experienced', 'value_json': '""not applicable""'}, {'short_name': 'Harm Type Experienced', 'value_json': '""not applicable""'}]}; {'attributes': [{'short_name': 'Entity', 'value_json': '""SST""'}, {'short_name': 'Named Entity', 'value_json': 'true'}, {'short_name': 'Entity type', 'value_json': '""for-profit organization""'}, {'short_name': 'Entity Relationship to the AI', 'value_json': '[""developer""]'}, {'short_name': 'Harm Category Experienced', 'value_json': '""not applicable""'}, {'short_name': 'Harm Type Experienced', 'value_json': '""not applicable""'}]}; {'attributes': [{'short_name': 'Entity', 'value_json': '""Troy Police Patrol""'}, {'short_name': 'Named Entity', 'value_json': 'true'}, {'short_name': 'Entity type', 'value_json': '""government entity""'}, {'short_name': 'Entity Relationship to the AI', 'value_json': '[""deployer"",""user""]'}, {'short_name': 'Harm Category Experienced', 'value_json': '""AI tangible harm event""'}, {'short_name': 'Harm Type Experienced', 'value_json': '""financial loss""'}, {'short_name': 'Notes (Characterizing Entities and the Harm)', 'value_json': '""\\""Dropping the system means the city will save $39,000 in annual costs.\\""\\n\\n\\""the city installed it for $250,000 in 2009 using drug forfeiture money to cover the cost.\\""\\n\\n\\""Moving one of the listening devices, he said, cost $6,5000.\\""""'}]}; {'attributes': [{'short_name': 'Entity', 'value_json': '""Charlotte Mecklenburg Police Department""'}, {'short_name': 'Named Entity', 'value_json': 'true'}, {'short_name': 'Entity type', 'value_json': '""government entity""'}, {'short_name': 'Entity Relationship to the AI', 'value_json': '[""deployer"",""user""]'}, {'short_name': 'Harm Category Experienced', 'value_json': '""not applicable""'}, {'short_name': 'Harm Type Experienced', 'value_json': '""not applicable""'}, {'short_name': 'Notes (Characterizing Entities and the Harm)', 'value_json': '""The Charlotte-Mecklenburg Police Department in North Carolina did not renew its annual contract with ShotSpotter in 2016 because if failed to help them make arrests or identify victims.""'}]}; {'attributes': [{'short_name': 'Entity', 'value_json': '""Residents in neighborhoods with ShotSpotter microphones""'}, {'short_name': 'Named Entity', 'value_json': 'false'}, {'short_name': 'Entity type', 'value_json': '""group of individuals""'}, {'short_name': 'Entity Relationship to the AI', 'value_json': '[""affected non-users""]'}, {'short_name': 'Harm Category Experienced', 'value_json': '""Other harm not meeting CSET definitions""'}, {'short_name': 'Harm Type Experienced', 'value_json': '""other tangible harm""'}, {'short_name': 'Notes (Characterizing Entities and the Harm)', 'value_json': '""Residents may experience overpolicing and violations of privacy due to ShotSpotter""'}]}; {'attributes': [{'short_name': 'Entity', 'value_json': '""Various US Police Departments""'}, {'short_name': 'Named Entity', 'value_json': 'false'}, {'short_name': 'Entity type', 'value_json': '""government entity""'}, {'short_name': 'Entity Relationship to the AI', 'value_json': '[""deployer"",""user""]'}, {'short_name': 'Harm Category Experienced', 'value_json': '""not applicable""'}, {'short_name': 'Harm Type Experienced', 'value_json': '""not applicable""'}, {'short_name': 'Notes (Characterizing Entities and the Harm)', 'value_json': '""Known police departments are: Troy PD, San Francisco PD, Charlotte-Mecklenburg PD, Detroit PD, Oakland PD, Fall River PD, Chicago PD, Portland PD, San Diego PD, New York City PD, Syracuse PD""'}]}; {'attributes': [{'short_name': 'Entity', 'value_json': '""ShotSpotter Inc.""'}, {'short_name': 'Named Entity', 'value_json': 'true'}, {'short_name': 'Entity type', 'value_json': '""for-profit organization""'}, {'short_name': 'Entity Relationship to the AI', 'value_json': '[""developer""]'}, {'short_name': 'Harm Category Experienced', 'value_json': '""not applicable""'}, {'short_name': 'Harm Type Experienced', 'value_json': '""not applicable""'}]}; {'attributes': [{'short_name': 'Entity', 'value_json': '""City of Chicago Inspector General""'}, {'short_name': 'Named Entity', 'value_json': 'true'}, {'short_name': 'Entity type', 'value_json': '""government entity""'}, {'short_name': 'Entity Relationship to the AI', 'value_json': '[""government oversight""]'}, {'short_name': 'Harm Category Experienced', 'value_json': '""not applicable""'}, {'short_name': 'Harm Type Experienced', 'value_json': '""not applicable""'}]}; {'attributes': [{'short_name': 'Entity', 'value_json': '""Surveillance Technology Oversight Project""'}, {'short_name': 'Named Entity', 'value_json': 'true'}, {'short_name': 'Entity type', 'value_json': '""non-profit organization""'}, {'short_name': 'Entity Relationship to the AI', 'value_json': '[""watchdog""]'}, {'short_name': 'Harm Category Experienced', 'value_json': '""not applicable""'}, {'short_name': 'Harm Type Experienced', 'value_json': '""not applicable""'}]}; {'attributes': [{'short_name': 'Entity', 'value_json': '""MacArthur Justice Center""'}, {'short_name': 'Named Entity', 'value_json': 'true'}, {'short_name': 'Entity type', 'value_json': '""non-profit organization""'}, {'short_name': 'Entity Relationship to the AI', 'value_json': '[""watchdog""]'}, {'short_name': 'Harm Category Experienced', 'value_json': '""not applicable""'}, {'short_name': 'Harm Type Experienced', 'value_json': '""not applicable""'}]}; {'attributes': [{'short_name': 'Entity', 'value_json': '""Brighton Park Neighborhood Council""'}, {'short_name': 'Named Entity', 'value_json': 'true'}, {'short_name': 'Entity type', 'value_json': '""non-profit organization""'}, {'short_name': 'Entity Relationship to the AI', 'value_json': '[""watchdog""]'}, {'short_name': 'Harm Category Experienced', 'value_json': '""not applicable""'}, {'short_name': 'Harm Type Experienced', 'value_json': '""not applicable""'}]}; {'attributes': [{'short_name': 'Entity', 'value_json': '""Lucy Parsons Lab""'}, {'short_name': 'Named Entity', 'value_json': 'true'}, {'short_name': 'Entity type', 'value_json': '""non-profit organization""'}, {'short_name': 'Entity Relationship to the AI', 'value_json': '[""watchdog""]'}, {'short_name': 'Harm Category Experienced', 'value_json': '""not applicable""'}, {'short_name': 'Harm Type Experienced', 'value_json': '""not applicable""'}]}; {'attributes': [{'short_name': 'Entity', 'value_json': '""Organized Communities Against Deportation""'}, {'short_name': 'Named Entity', 'value_json': 'true'}, {'short_name': 'Entity type', 'value_json': '""non-profit organization""'}, {'short_name': 'Entity Relationship to the AI', 'value_json': '[""watchdog""]'}, {'short_name': 'Harm Category Experienced', 'value_json': '""not applicable""'}, {'short_name': 'Harm Type Experienced', 'value_json': '""not applicable""'}]}; {'attributes': [{'short_name': 'Entity', 'value_json': '""Low-income and minority neighborhoods""'}, {'short_name': 'Named Entity', 'value_json': 'false'}, {'short_name': 'Entity type', 'value_json': '""public space""'}, {'short_name': 'Entity Relationship to the AI', 'value_json': '[""geographic area of use""]'}, {'short_name': 'Harm Category Experienced', 'value_json': '""AI special interest intangible harm""'}, {'short_name': 'Harm Type Experienced', 'value_json': '""disproportionate treatment based upon a protected characteristic""'}]}; {'attributes': [{'short_name': 'Entity', 'value_json': '""Residents in affected neighborhoods""'}, {'short_name': 'Named Entity', 'value_json': 'false'}, {'short_name': 'Entity type', 'value_json': '""group of individuals""'}, {'short_name': 'Entity Relationship to the AI', 'value_json': '[""affected non-user""]'}, {'short_name': 'Harm Category Experienced', 'value_json': '""AI tangible harm issue""'}, {'short_name': 'Harm Type Experienced', 'value_json': '""physical health/safety""'}]}; {'attributes': [{'short_name': 'Entity', 'value_json': '""ShotSpotter analysts""'}, {'short_name': 'Named Entity', 'value_json': 'false'}, {'short_name': 'Entity type', 'value_json': '""group of individuals""'}, {'short_name': 'Entity Relationship to the AI', 'value_json': '[""user""]'}, {'short_name': 'Harm Category Experienced', 'value_json': '""not applicable""'}, {'short_name': 'Harm Type Experienced', 'value_json': '""not applicable""'}, {'short_name': 'Notes (Characterizing Entities and the Harm)', 'value_json': '""Verify the data transmitted by the system, classifying noises as gunshots or not before passing on alerts to police departments.""'}]}; {'attributes': [{'short_name': 'Entity', 'value_json': '""Michael Williams""'}, {'short_name': 'Named Entity', 'value_json': 'true'}, {'short_name': 'Entity type', 'value_json': '""individual""'}, {'short_name': 'Entity Relationship to the AI', 'value_json': '[""affected non-user""]'}, {'short_name': 'Harm Category Experienced', 'value_json': '""AI tangible harm event""'}, {'short_name': 'Harm Type Experienced', 'value_json': '""physical health/safety""'}, {'short_name': 'Notes (Characterizing Entities and the Harm)', 'value_json': '""Michael Williams spent a year in jail on murder charges based on evidence from ShotSpotter before having his charges dismissed when prosecutors admitted they had insufficient evidence against him.\\n\\nCSET considers wrongful imprisonment to be a tangible harm because of loss of personal freedom and autonomy""'}]}; {'attributes': [{'short_name': 'Entity', 'value_json': '""Action Center on Race and the Economy""'}, {'short_name': 'Named Entity', 'value_json': 'true'}, {'short_name': 'Entity type', 'value_json': '""non-profit organization""'}, {'short_name': 'Entity Relationship to the AI', 'value_json': '[""watchdog""]'}, {'short_name': 'Harm Category Experienced', 'value_json': '""not applicable""'}, {'short_name': 'Harm Type Experienced', 'value_json': '""not applicable""'}]}; {'attributes': [{'short_name': 'Entity', 'value_json': '""Adam Toledo""'}, {'short_name': 'Named Entity', 'value_json': 'true'}, {'short_name': 'Entity type', 'value_json': '""individual""'}, {'short_name': 'Entity Relationship to the AI', 'value_json': '[""affected non-user""]'}, {'short_name': 'Harm Category Experienced', 'value_json': '""AI tangible harm event""'}, {'short_name': 'Harm Type Experienced', 'value_json': '""physical health/safety""'}]}",1,0,True,"It is possible that more lives lost could be attributed to the ShotSpotter's performance.  Currently, the reports only mention one loss.","The ShotSpotter system records all loud noises, using at least three microphones to locate gunshots within a 25-meter radius. Then, SST staff review each report to make sure the computer flags only gunshots. The technology's accuracy depends on everything from ""topography, temperature, humidity and wind speed, as well as the trained ears of employees.""",microphone inputs; audio,"ShotSpotter detects loud noises and sends the information to human reviewers employed by ShotSpotter. Reviewers have the option to change the detection results from the system.  After review, the gunshot detections are sent to police departments.",microphones,detect gunshots; locate gunshots; identify weapon calibre; predict shooter movement,
