incident_id,title,date,alleged_developer,alleged_deployer,alleged_harmed_parties,Harm Distribution Basis,Sector of Deployment,Physical Objects,Entertainment Industry,"Report, Test, or Study of data",Deployed,Producer Test in Controlled Conditions,Producer Test in Operational Conditions,User Test in Controlled Conditions,User Test in Operational Conditions,Harm Domain,Tangible Harm,AI System,Clear link to technology,There is a potentially identifiable specific entity that experienced the harm,AI Harm Level,Impact on Critical Services,Rights Violation,Involving Minor,Detrimental Content,Protected Characteristic,Clear link to Technology,Harmed Class of Entities,Annotator’s AI special interest intangible harm assessment,Public Sector Deployment,Autonomy Level,Intentional Harm,AI tools and methods,Peer Reviewer,Quality Control,Annotation Status,Incident Number,Annotator,AI Tangible Harm Level Notes,Notes (special interest intangible harm),Special Interest Intangible Harm,Notes (AI special interest intangible harm),Date of Incident Year,Date of Incident Month,Date of Incident Day,Estimated Date,Multiple AI Interaction,Embedded,Location City,Location State/Province (two letters),Location Country (two letters),Location Region,Infrastructure Sectors,Operating Conditions,Notes (Environmental and Temporal Characteristics),Entities,Lives Lost,Injuries,Estimated Harm Quantities,Notes ( Tangible Harm Quantities Information),AI System Description,Data Inputs,Notes (Information about AI System),Physical System Type,AI Task,Notes (AI Functionality and Techniques)
1,Google’s YouTube Kids App Presents Inappropriate Content,2015-05-19,youtube,youtube,children,none,"Arts, entertainment and recreation; information and communication",no,yes,no,yes,no,no,no,no,yes,"no tangible harm, near-miss, or issue",yes,yes,True,none,no,no,yes,yes,no,yes,True,yes,no,Autonomy1,No. Not intentionally designed to perform harm,,002,False,6. Complete and final,1,,,,yes,,2016,,,True,no,no,,,US,North America,,,,"{'attributes': [{'short_name': 'Entity', 'value_json': '""Google""'}, {'short_name': 'Named Entity', 'value_json': 'true'}, {'short_name': 'Entity type', 'value_json': '""for-profit organization""'}, {'short_name': 'Entity Relationship to the AI', 'value_json': '[""developer"",""deployer""]'}, {'short_name': 'Harm Category Experienced', 'value_json': '""not applicable""'}, {'short_name': 'Harm Type Experienced', 'value_json': '""not applicable""'}]}; {'attributes': [{'short_name': 'Entity', 'value_json': '""YouTube Kids""'}, {'short_name': 'Named Entity', 'value_json': 'true'}, {'short_name': 'Entity type', 'value_json': '""product""'}, {'short_name': 'Entity Relationship to the AI', 'value_json': '[""product containing AI""]'}, {'short_name': 'Harm Category Experienced', 'value_json': '""not applicable""'}, {'short_name': 'Harm Type Experienced', 'value_json': '""not applicable""'}]}; {'attributes': [{'short_name': 'Entity', 'value_json': '""Children watching Youtube Kids""'}, {'short_name': 'Named Entity', 'value_json': 'false'}, {'short_name': 'Entity type', 'value_json': '""group of individuals""'}, {'short_name': 'Entity Relationship to the AI', 'value_json': '[""user""]'}, {'short_name': 'Harm Category Experienced', 'value_json': '""AI special interest intangible harm""'}, {'short_name': 'Harm Type Experienced', 'value_json': '""detrimental content""'}]}",0,0,False,,Content-recommendation and filtering algorithm,Youtube videos,9.5 - Content-moderation algorithms like the one involved in this incident are supposed to work without requiring human review or intervention.,,content moderation,
2,Warehouse robot ruptures can of bear spray and injures workers,2018-12-05,amazon,amazon,warehouse-workers,none,wholesale and retail trade,yes,no,no,yes,no,no,no,no,yes,tangible harm definitively occurred,no,yes,True,none,no,no,no,no,no,yes,True,no,no,unclear,No. Not intentionally designed to perform harm,,002,False,6. Complete and final,2,,,,no,,2018,12,05,False,no,yes,Robbinsville,NJ,US,North America,,,,"{'attributes': [{'short_name': 'Entity', 'value_json': '""Amazon""'}, {'short_name': 'Named Entity', 'value_json': 'true'}, {'short_name': 'Entity type', 'value_json': '""for-profit organization""'}, {'short_name': 'Entity Relationship to the AI', 'value_json': '[""deployer""]'}, {'short_name': 'Harm Category Experienced', 'value_json': '""not applicable""'}, {'short_name': 'Harm Type Experienced', 'value_json': '""not applicable""'}]}; {'attributes': [{'short_name': 'Entity', 'value_json': '""Amazon robot""'}, {'short_name': 'Named Entity', 'value_json': 'false'}, {'short_name': 'Entity type', 'value_json': '""product""'}, {'short_name': 'Notes (Characterizing Entities and the Harm)', 'value_json': '""7.4 - the product did not contain AI""'}, {'short_name': 'Harm Category Experienced', 'value_json': '""not applicable""'}, {'short_name': 'Harm Type Experienced', 'value_json': '""not applicable""'}, {'short_name': 'Entity Relationship to the AI', 'value_json': '[""product not containing AI""]'}]}; {'attributes': [{'short_name': 'Entity', 'value_json': '""Amazon fulfillment center workers""'}, {'short_name': 'Named Entity', 'value_json': 'false'}, {'short_name': 'Entity type', 'value_json': '""group of individuals""'}, {'short_name': 'Harm Category Experienced', 'value_json': '""Other harm not meeting CSET definitions""'}, {'short_name': 'Harm Type Experienced', 'value_json': '""physical health/safety""'}, {'short_name': 'Notes (Characterizing Entities and the Harm)', 'value_json': '""7.6 - workers at the fulfillment center in Robbinsville experienced harm to their physical health/safety, but it was not because of AI""'}, {'short_name': 'Entity Relationship to the AI', 'value_json': '[""affected non-users"",""users""]'}]}",0,54,False,"24 workers were hospitalized out of the 54 total injured, but harm not caused by AI ","The robot was a warehouse assistance robot, but the technology did not include AI.",,,,,not AI
3,Crashes with Maneuvering Characteristics Augmentation System (MCAS),2018-10-27,boeing,boeing,"airplane-passengers, airplane-crew",none,transportation and storage,yes,no,no,yes,no,no,no,no,yes,tangible harm definitively occurred,maybe,yes,True,unclear,no,no,no,no,no,yes,True,no,no,Autonomy1,No. Not intentionally designed to perform harm,,002,False,6. Complete and final,3,,It is unclear whether the MCAS system relied on machine learning or other contemporary AI methods instead of sophisticated rules.,,no,,2018,10,29,False,no,yes,Java Sea,,ID,Asia,transportation,,,"{'attributes': [{'short_name': 'Entity', 'value_json': '""Boeing""'}, {'short_name': 'Named Entity', 'value_json': 'true'}, {'short_name': 'Entity type', 'value_json': '""for-profit organization""'}, {'short_name': 'Entity Relationship to the AI', 'value_json': '[""developer""]'}, {'short_name': 'Harm Category Experienced', 'value_json': '""not applicable""'}, {'short_name': 'Harm Type Experienced', 'value_json': '""not applicable""'}]}; {'attributes': [{'short_name': 'Entity', 'value_json': '""Boeing 737 MAX Airplane""'}, {'short_name': 'Named Entity', 'value_json': 'true'}, {'short_name': 'Entity type', 'value_json': '""product""'}, {'short_name': 'Entity Relationship to the AI', 'value_json': '[""product maybe containing AI""]'}, {'short_name': 'Harm Category Experienced', 'value_json': '""Other harm not meeting CSET definitions""'}, {'short_name': 'Harm Type Experienced', 'value_json': '""physical property""'}]}; {'attributes': [{'short_name': 'Entity', 'value_json': '""Crew on Lion Air Flight 610""'}, {'short_name': 'Named Entity', 'value_json': 'false'}, {'short_name': 'Entity type', 'value_json': '""group of individuals""'}, {'short_name': 'Entity Relationship to the AI', 'value_json': '[""user""]'}, {'short_name': 'Harm Category Experienced', 'value_json': '""Other harm not meeting CSET definitions""'}, {'short_name': 'Harm Type Experienced', 'value_json': '""physical health/safety""'}]}; {'attributes': [{'short_name': 'Entity', 'value_json': '""Passengers on Lion Air Flight 610 ""'}, {'short_name': 'Named Entity', 'value_json': 'false'}, {'short_name': 'Entity type', 'value_json': '""group of individuals""'}, {'short_name': 'Harm Category Experienced', 'value_json': '""Other harm not meeting CSET definitions""'}, {'short_name': 'Harm Type Experienced', 'value_json': '""physical health/safety""'}, {'short_name': 'Entity Relationship to the AI', 'value_json': '[""affected non-users""]'}]}; {'attributes': [{'short_name': 'Entity', 'value_json': '""MCAS (maneuvering characteristics augmentation system)""'}, {'short_name': 'Named Entity', 'value_json': 'true'}, {'short_name': 'Entity type', 'value_json': '""product""'}, {'short_name': 'Entity Relationship to the AI', 'value_json': '[""technology""]'}, {'short_name': 'Harm Category Experienced', 'value_json': '""not applicable""'}, {'short_name': 'Harm Type Experienced', 'value_json': '""not applicable""'}]}; {'attributes': [{'short_name': 'Entity', 'value_json': '""Lion Air""'}, {'short_name': 'Named Entity', 'value_json': 'true'}, {'short_name': 'Entity type', 'value_json': '""for-profit organization""'}, {'short_name': 'Entity Relationship to the AI', 'value_json': '[""deployer""]'}, {'short_name': 'Harm Category Experienced', 'value_json': '""not applicable""'}, {'short_name': 'Harm Type Experienced', 'value_json': '""not applicable""'}]}",189,0,False,,Maneuvering Characteristics Augmentation System (MCAS) is  a computerized system Boeing installed on its latest generation of 737 airplanes to prevent the plane’s nose from getting too high.,sensor data,"While pilots were supposed to be able to override MCAS' actions, they weren't during the incident in question.",Boeing 737 Max airplane,,not AI
4,Uber AV Killed Pedestrian in Arizona,2018-03-18,uber,uber,"elaine-herzberg, pedestrians",none,transportation and storage,yes,no,no,no,no,yes,no,no,yes,tangible harm definitively occurred,yes,yes,True,AI tangible harm event,no,no,no,no,no,yes,True,no,no,Autonomy2,No. Not intentionally designed to perform harm,,002,False,6. Complete and final,4,,,,no,,2018,03,18,False,no,yes,Tempe,AZ,US,North America,,night,,"{'attributes': [{'short_name': 'Entity', 'value_json': '""Uber""'}, {'short_name': 'Named Entity', 'value_json': 'true'}, {'short_name': 'Entity type', 'value_json': '""for-profit organization""'}, {'short_name': 'Entity Relationship to the AI', 'value_json': '[""developer"",""deployer""]'}, {'short_name': 'Harm Category Experienced', 'value_json': '""AI tangible harm event""'}, {'short_name': 'Harm Type Experienced', 'value_json': '""financial loss""'}, {'short_name': 'Notes (Characterizing Entities and the Harm)', 'value_json': '""Uber incurred costs due to the accident including a settlement to the victim\'s family (low millions) and the costs of the operator\'s attorney. ""'}]}; {'attributes': [{'short_name': 'Entity', 'value_json': '""Volvo XC90 SUV autonomous vehicle""'}, {'short_name': 'Named Entity', 'value_json': 'false'}, {'short_name': 'Entity type', 'value_json': '""product""'}, {'short_name': 'Entity Relationship to the AI', 'value_json': '[""product containing AI""]'}, {'short_name': 'Harm Category Experienced', 'value_json': '""AI tangible harm event""'}, {'short_name': 'Harm Type Experienced', 'value_json': '""physical property""'}, {'short_name': 'Notes (Characterizing Entities and the Harm)', 'value_json': '""Owned, equipped and operated by Uber.""'}]}; {'attributes': [{'short_name': 'Entity', 'value_json': '""Elaine Herzberg""'}, {'short_name': 'Named Entity', 'value_json': 'true'}, {'short_name': 'Entity type', 'value_json': '""individual""'}, {'short_name': 'Notes (Characterizing Entities and the Harm)', 'value_json': '""""'}, {'short_name': 'Harm Category Experienced', 'value_json': '""AI tangible harm event""'}, {'short_name': 'Harm Type Experienced', 'value_json': '""physical health/safety""'}, {'short_name': 'Entity Relationship to the AI', 'value_json': '[""affected non-user""]'}]}; {'attributes': [{'short_name': 'Entity', 'value_json': '""Rafaela Vasquez""'}, {'short_name': 'Named Entity', 'value_json': 'true'}, {'short_name': 'Entity type', 'value_json': '""individual""'}, {'short_name': 'Entity Relationship to the AI', 'value_json': '[""user""]'}, {'short_name': 'Harm Category Experienced', 'value_json': '""AI tangible harm event""'}, {'short_name': 'Harm Type Experienced', 'value_json': '""financial loss""'}, {'short_name': 'Notes (Characterizing Entities and the Harm)', 'value_json': '""Following the accident, Rafaela Vasquez was let go from Uber and incurred legal costs when she was indicted with negligent homicide.""'}]}",1,0,False,,Autonomous driving system by Uber,lidar; radar; video input; sensor data,"The car was operating in autonomous mode at the time of the incident, but with a safety operator on board who could have taken action. ",Volvo XC90 SUV,self-driving; navigation,
5,Collection of Robotic Surgery Malfunctions,2015-07-13,intuitive-surgical,"hospitals, doctors",patients,none,human health and social work activities,yes,no,yes,yes,no,no,no,no,yes,tangible harm definitively occurred,no,yes,True,none,no,no,no,no,no,yes,True,no,no,Autonomy3,No. Not intentionally designed to perform harm,,002,False,6. Complete and final,5,,No evidence that robots used AI.  Robots are guided by surgeons to make precise cuts.,,no,"Only tangible, no intangible, harm was reported",2000,,,True,no,yes,,,US,North America,healthcare and public health,,Time period covered: 2000-2013,"{'attributes': [{'short_name': 'Entity', 'value_json': '""UIUC Researchers""'}, {'short_name': 'Named Entity', 'value_json': 'true'}, {'short_name': 'Entity type', 'value_json': '""group of individuals""'}, {'short_name': 'Entity Relationship to the AI', 'value_json': '[""researcher""]'}, {'short_name': 'Harm Category Experienced', 'value_json': '""not applicable""'}, {'short_name': 'Harm Type Experienced', 'value_json': '""not applicable""'}, {'short_name': 'Notes (Characterizing Entities and the Harm)', 'value_json': '"" Homa Alemzadeh, Ravishankar K. Iyer, Zbigniew Kalbarczyk, Nancy Leveson, Jai Raman""'}]}; {'attributes': [{'short_name': 'Entity', 'value_json': '""Surgeons""'}, {'short_name': 'Named Entity', 'value_json': 'false'}, {'short_name': 'Entity type', 'value_json': '""group of individuals""'}, {'short_name': 'Entity Relationship to the AI', 'value_json': '[""user""]'}, {'short_name': 'Harm Category Experienced', 'value_json': '""not applicable""'}, {'short_name': 'Harm Type Experienced', 'value_json': '""not applicable""'}]}; {'attributes': [{'short_name': 'Entity', 'value_json': '""Patients""'}, {'short_name': 'Named Entity', 'value_json': 'false'}, {'short_name': 'Entity type', 'value_json': '""group of individuals""'}, {'short_name': 'Entity Relationship to the AI', 'value_json': '[""affected non-user""]'}, {'short_name': 'Harm Category Experienced', 'value_json': '""Other harm not meeting CSET definitions""'}, {'short_name': 'Harm Type Experienced', 'value_json': '""physical health/safety""'}]}; {'attributes': [{'short_name': 'Entity', 'value_json': '""Da Vinci robotic system""'}, {'short_name': 'Named Entity', 'value_json': 'true'}, {'short_name': 'Entity type', 'value_json': '""product""'}, {'short_name': 'Entity Relationship to the AI', 'value_json': '[""product not containing AI""]'}, {'short_name': 'Harm Category Experienced', 'value_json': '""not applicable""'}, {'short_name': 'Harm Type Experienced', 'value_json': '""not applicable""'}]}; {'attributes': [{'short_name': 'Entity', 'value_json': '""Intuitive Surgery""'}, {'short_name': 'Named Entity', 'value_json': 'true'}, {'short_name': 'Entity type', 'value_json': '""for-profit organization""'}, {'short_name': 'Entity Relationship to the AI', 'value_json': '[""developer""]'}, {'short_name': 'Harm Category Experienced', 'value_json': '""not applicable""'}, {'short_name': 'Harm Type Experienced', 'value_json': '""not applicable""'}]}",144,1391,False,study identified 1391 injuries and 144 deaths associated with robot-assisted surgeries. Not reports of AI embedded in robots.,Surgery robot. ,video input,"Robotic surgical tools have been adopted broadly across minimally invasive surgeries in fields like gynecology, urology, general, colorectal, cardiothoracic, and head and neck surgery.",medical robot,,
6,"Microsoft's TayBot Allegedly Posts Racist, Sexist, and Anti-Semitic Content to Twitter",2016-03-24,microsoft,microsoft,twitter-users,"race; religion; sex; ideology; nation of origin, citizenship, immigrant status",information and communication,no,maybe,no,yes,no,no,no,yes,yes,"no tangible harm, near-miss, or issue",yes,yes,True,none,no,no,no,yes,yes,yes,True,yes,no,Autonomy1,No. Not intentionally designed to perform harm,human language technology,002,False,6. Complete and final,6,,,"4.6 - Tay's tweets included racist and misogynist content, far-right ideology, and harmful content against certain religions, etc.",yes,,2016,03,23,False,no,no,,,,Global,,,,"{'attributes': [{'short_name': 'Entity', 'value_json': '""TayBot""'}, {'short_name': 'Named Entity', 'value_json': 'true'}, {'short_name': 'Entity type', 'value_json': '""product""'}, {'short_name': 'Entity Relationship to the AI', 'value_json': '[""product containing AI""]'}, {'short_name': 'Harm Category Experienced', 'value_json': '""not applicable""'}, {'short_name': 'Harm Type Experienced', 'value_json': '""not applicable""'}]}; {'attributes': [{'short_name': 'Entity', 'value_json': '""Microsoft""'}, {'short_name': 'Named Entity', 'value_json': 'true'}, {'short_name': 'Entity type', 'value_json': '""for-profit organization""'}, {'short_name': 'Entity Relationship to the AI', 'value_json': '[""developer"",""deployer""]'}, {'short_name': 'Harm Category Experienced', 'value_json': '""not applicable""'}, {'short_name': 'Harm Type Experienced', 'value_json': '""not applicable""'}]}; {'attributes': [{'short_name': 'Entity', 'value_json': '""Groups with protected characteristics""'}, {'short_name': 'Named Entity', 'value_json': 'false'}, {'short_name': 'Entity type', 'value_json': '""group of individuals""'}, {'short_name': 'Entity Relationship to the AI', 'value_json': '[""affected non-user""]'}, {'short_name': 'Harm Category Experienced', 'value_json': '""AI special interest intangible harm""'}, {'short_name': 'Harm Type Experienced', 'value_json': '""disproportionate treatment based upon a protected characteristic""'}, {'short_name': 'Notes (Characterizing Entities and the Harm)', 'value_json': '""7.6 - Groups disproportionately targeted in hate speech by TayBot include Mexican nationals, women, Black people, Jewish people, and more. However, TayBot did not necessarily treat users disproportionately with an awareness of users\' identities.""'}]}; {'attributes': [{'short_name': 'Entity', 'value_json': '""Twitter users""'}, {'short_name': 'Named Entity', 'value_json': 'false'}, {'short_name': 'Entity type', 'value_json': '""group of individuals""'}, {'short_name': 'Harm Category Experienced', 'value_json': '""AI special interest intangible harm""'}, {'short_name': 'Harm Type Experienced', 'value_json': '""detrimental content""'}, {'short_name': 'Entity Relationship to the AI', 'value_json': '[""affected non-user"",""user""]'}]}",0,0,False,,Microsoft created a chat bot named Tay with the intent of mimicking and engaging with 18-24 year old social media users.,text; images; personal information,"9.2 - Limited personal information Tay could have access to included: nickname, gender, favorite food, zip code, and relationship status. Users could opt in to giving Tay access to that information.",,chat bot,
7,Wikipedia Vandalism Prevention Bot Loop,2017-02-24,wikipedia,wikipedia,"wikimedia-foundation, wikipedia-editors, wikipedia-users",none,information and communication,no,no,no,yes,no,no,no,no,yes,"no tangible harm, near-miss, or issue",maybe,yes,False,none,no,no,no,no,no,yes,False,no,no,Autonomy1,No. Not intentionally designed to perform harm,regular expressions; natural language processing,002,False,6. Complete and final,7,,"It is unclear if any of the Wikipedia bots under study relies on machine learning technology, but it is unlikely. Nobody experienced any harm. ",,no,,2001,,,False,yes,no,,,,Global,,,"Although AI involvement is unlikely, the study analyzed bot-on-bot conflict, i.e. the interaction of multiple autonomous systems. ","{'attributes': [{'short_name': 'Entity', 'value_json': '""Wikipedia bots""'}, {'short_name': 'Named Entity', 'value_json': 'false'}, {'short_name': 'Entity type', 'value_json': '""product""'}, {'short_name': 'Entity Relationship to the AI', 'value_json': '[""product not containing AI""]'}, {'short_name': 'Harm Category Experienced', 'value_json': '""not applicable""'}, {'short_name': 'Harm Type Experienced', 'value_json': '""not applicable""'}]}; {'attributes': [{'short_name': 'Entity', 'value_json': '""Oxford and Alan Turing Institute Researchers""'}, {'short_name': 'Named Entity', 'value_json': 'true'}, {'short_name': 'Entity type', 'value_json': '""group of individuals""'}, {'short_name': 'Entity Relationship to the AI', 'value_json': '[""researcher""]'}, {'short_name': 'Harm Category Experienced', 'value_json': '""not applicable""'}, {'short_name': 'Harm Type Experienced', 'value_json': '""not applicable""'}, {'short_name': 'Notes (Characterizing Entities and the Harm)', 'value_json': '""Milena Tsvetkova,Ruth García-Gavilanes,Luciano Floridi,Taha Yasseri ""'}]}; {'attributes': [{'short_name': 'Entity', 'value_json': '""Wikipedia""'}, {'short_name': 'Named Entity', 'value_json': 'true'}, {'short_name': 'Entity type', 'value_json': '""non-profit organization""'}, {'short_name': 'Entity Relationship to the AI', 'value_json': '[""developer"",""deployer""]'}, {'short_name': 'Harm Category Experienced', 'value_json': '""not applicable""'}, {'short_name': 'Harm Type Experienced', 'value_json': '""not applicable""'}]}; {'attributes': [{'short_name': 'Entity', 'value_json': '""Wikipedia Editors""'}, {'short_name': 'Named Entity', 'value_json': 'false'}, {'short_name': 'Entity type', 'value_json': '""group of individuals""'}, {'short_name': 'Entity Relationship to the AI', 'value_json': '[""affected non-user""]'}, {'short_name': 'Harm Category Experienced', 'value_json': '""not applicable""'}, {'short_name': 'Harm Type Experienced', 'value_json': '""not applicable""'}, {'short_name': 'Notes (Characterizing Entities and the Harm)', 'value_json': '""""'}]}; {'attributes': [{'short_name': 'Entity', 'value_json': '""Wikipedia Users""'}, {'short_name': 'Named Entity', 'value_json': 'false'}, {'short_name': 'Entity type', 'value_json': '""group of individuals""'}, {'short_name': 'Entity Relationship to the AI', 'value_json': '[""affected non-user""]'}, {'short_name': 'Harm Category Experienced', 'value_json': '""not applicable""'}, {'short_name': 'Harm Type Experienced', 'value_json': '""not applicable""'}]}",0,0,False,,"Wikipedia bots are intended to autonomously correct spelling, maintain links, and monitor vandalism on Wikipedia pages.",text,,,webpage maintenance; editing,
